{"updated_utc": "2026-10-01T13:10:22Z", "pool": {"hashrate": 0.0, "workers_online": 1, "shares_total": 18092, "shares_rejected": 21, "valid_rate": 0.9988, "difficulty": 128.0, "uptime_seconds": 809.8, "shares_1m": 0}, "network": {"height": 3502619, "difficulty": 215468638.87984714, "network_solps": 27306636227.0, "connections": 9, "node_version": "/Zebra:6.3.0/", "block_time_target": 75, "mempool_txs": 2, "blocks_to_halving": 691685, "verification_progress": 1.0}, "price": {"usd": 1402.6, "usd_24h_change": -1.8158399484788705, "source": "blockchair"}, "template": {"template_height": 3502620, "miner_reward": 125540200, "lockbox_value": 12500000, "lockbox_address": "t3cFfPt1Bcvgez9ZbMBFWeZsskxTkPzGCow", "miner_payout_shielded": true, "txs": 4}, "indexer": {"pool_blocks": 0, "cached_blocks": 781}}